{
  "$schema": "../schema/skill-decomposition.schema.json",
  "meta": {
    "skill_id": "claude__composio__tailored_resume_generator",
    "name": "tailored-resume-generator",
    "skill_layer": "claude_skill",
    "title": "Tailored Resume Generator",
    "description": "Analyzes job descriptions and generates tailored resumes that highlight relevant experience, skills, and achievements to maximize interview chances",
    "schema_version": "2.1.0",
    "parse_timestamp": "2026-01-26T05:45:00Z",
    "parser_version": "skill-0 v2.1",
    "parsed_by": "skill-0"
  },
  "original_definition": {
    "source": "ComposioHQ/awesome-claude-skills",
    "skill_name": "tailored-resume-generator",
    "skill_description": "Analyzes job descriptions and generates tailored resumes that highlight relevant experience, skills, and achievements to maximize interview chances"
  },
  "decomposition": {
    "actions": [
      {
        "id": "a_001",
        "name": "Analyze Job Description",
        "action_type": "transform",
        "description": "Extract key requirements, skills, qualifications, and keywords from job posting",
        "immutable_elements": [
          "extraction patterns"
        ],
        "mutable_elements": [
          "job description text",
          "priority classification"
        ],
        "deterministic": false,
        "side_effects": []
      },
      {
        "id": "a_002",
        "name": "Gather Candidate Background",
        "action_type": "await_input",
        "description": "Collect work history, education, skills, achievements from user or existing resume",
        "immutable_elements": [
          "required fields"
        ],
        "mutable_elements": [
          "user input",
          "resume content"
        ],
        "deterministic": false,
        "side_effects": []
      },
      {
        "id": "a_003",
        "name": "Map Experience to Requirements",
        "action_type": "llm_inference",
        "description": "Match candidate experience to job requirements, identify transferable skills and gaps",
        "immutable_elements": [
          "matching algorithm"
        ],
        "mutable_elements": [
          "experience entries",
          "requirement priorities"
        ],
        "deterministic": false,
        "side_effects": []
      },
      {
        "id": "a_004",
        "name": "Generate Professional Summary",
        "action_type": "llm_inference",
        "description": "Create 3-4 line summary highlighting years of experience and top required skills",
        "immutable_elements": [
          "summary structure"
        ],
        "mutable_elements": [
          "content focus",
          "skill emphasis"
        ],
        "deterministic": false,
        "side_effects": []
      },
      {
        "id": "a_005",
        "name": "Reorder Experience Bullets",
        "action_type": "transform",
        "description": "Prioritize bullet points based on relevance to job requirements",
        "immutable_elements": [
          "relevance scoring"
        ],
        "mutable_elements": [
          "bullet order",
          "emphasis"
        ],
        "deterministic": false,
        "side_effects": []
      },
      {
        "id": "a_006",
        "name": "Optimize for ATS",
        "action_type": "transform",
        "description": "Incorporate keywords naturally for Applicant Tracking System compatibility",
        "immutable_elements": [
          "ATS best practices"
        ],
        "mutable_elements": [
          "keyword placement",
          "formatting"
        ],
        "deterministic": false,
        "side_effects": []
      },
      {
        "id": "a_007",
        "name": "Format Resume Output",
        "action_type": "transform",
        "description": "Create clean, professional resume layout in requested format",
        "immutable_elements": [
          "section structure"
        ],
        "mutable_elements": [
          "format type",
          "styling"
        ],
        "deterministic": true,
        "side_effects": []
      },
      {
        "id": "a_008",
        "name": "Generate Recommendations",
        "action_type": "llm_inference",
        "description": "Provide gap analysis and interview preparation tips",
        "immutable_elements": [
          "recommendation structure"
        ],
        "mutable_elements": [
          "gaps identified",
          "strengths found"
        ],
        "deterministic": false,
        "side_effects": []
      }
    ],
    "rules": [
      {
        "id": "r_001",
        "name": "Validate Job Description Provided",
        "condition_type": "existence_check",
        "condition_expression": "Job description text is provided",
        "returns": "boolean",
        "fail_action": "branch",
        "branching_targets": [
          "request job description"
        ]
      },
      {
        "id": "r_002",
        "name": "Validate Candidate Background",
        "condition_type": "existence_check",
        "condition_expression": "Sufficient background info provided",
        "returns": "boolean",
        "fail_action": "branch",
        "branching_targets": [
          "request more information"
        ]
      },
      {
        "id": "r_003",
        "name": "Check Experience Level Match",
        "condition_type": "range_check",
        "condition_expression": "Candidate years of experience within job requirements",
        "returns": "boolean",
        "fail_action": "branch",
        "branching_targets": [
          "note experience gap"
        ]
      }
    ],
    "directives": [
      {
        "id": "d_001",
        "name": "Resume Generation Complete",
        "directive_type": "completion",
        "description": "Tailored resume created with recommendations",
        "decomposable": true,
        "decomposition_hint": "r_001 → a_001 → r_002 → a_002 → a_003 → a_004 → a_005 → a_006 → a_007 → a_008",
        "related_elements": [
          "a_001",
          "a_003",
          "a_007"
        ]
      },
      {
        "id": "d_002",
        "name": "Truthfulness Constraint",
        "directive_type": "constraint",
        "description": "Never fabricate experience - be truthful and accurate",
        "decomposable": false
      },
      {
        "id": "d_003",
        "name": "Action Verb Principle",
        "directive_type": "principle",
        "description": "Use action verbs: Led, Developed, Implemented, Optimized, Managed, Created, Analyzed",
        "decomposable": false,
        "related_elements": [
          "a_005"
        ]
      },
      {
        "id": "d_004",
        "name": "Quantification Preference",
        "directive_type": "preference",
        "description": "Include numbers, percentages, timeframes, scale in achievements",
        "decomposable": false,
        "related_elements": [
          "a_005"
        ]
      },
      {
        "id": "d_005",
        "name": "Page Length Strategy",
        "directive_type": "strategy",
        "description": "1 page for <10 years experience, 2 pages for 10+ years",
        "decomposable": false,
        "related_elements": [
          "a_007"
        ]
      }
    ]
  },
  "execution_paths": [
    {
      "path_id": 1,
      "sequence": [
        "r_001",
        "a_001",
        "r_002",
        "a_002",
        "a_003",
        "a_004",
        "a_005",
        "a_006",
        "a_007",
        "a_008"
      ],
      "condition": "User provides job description and background",
      "expected_outcome": "Tailored resume with recommendations"
    },
    {
      "path_id": 2,
      "sequence": [
        "r_001",
        "a_001",
        "a_002",
        "a_003",
        "r_003",
        "a_004",
        "a_005",
        "a_006",
        "a_007",
        "a_008"
      ],
      "condition": "Career transition with experience gap",
      "expected_outcome": "Resume emphasizing transferable skills with gap notes"
    }
  ],
  "parser_meta": {
    "paths_enumerated": 2,
    "max_paths_exceeded": false,
    "max_paths_limit": 100,
    "decomposition_depth": 1,
    "directives_expandable": 1,
    "requires_deep_parse": false,
    "inconsistency_detected": false
  }
}
