{
  "$schema": "../schema/skill-decomposition.schema.json",
  "meta": {
    "skill_id": "claude__composio__connect_apps",
    "name": "connect-apps",
    "skill_layer": "claude_skill",
    "title": "Connect Apps",
    "description": "Connect Claude to external apps like Gmail, Slack, GitHub. Use this skill when the user wants to send emails, create issues, post messages, or take actions in external services",
    "schema_version": "2.4.0",
    "parse_timestamp": "2026-01-26T05:45:00Z",
    "parser_version": "skill-0 v2.1",
    "parsed_by": "skill-0"
  },
  "original_definition": {
    "source": "ComposioHQ/awesome-claude-skills",
    "skill_name": "connect-apps",
    "skill_description": "Connect Claude to external apps like Gmail, Slack, GitHub. Use this skill when the user wants to send emails, create issues, post messages, or take actions in external services."
  },
  "decomposition": {
    "actions": [
      {
        "id": "a_001",
        "name": "Install Composio Plugin",
        "action_type": "external_call",
        "description": "Install composio-toolrouter plugin",
        "immutable_elements": [
          "/plugin install command"
        ],
        "mutable_elements": [],
        "deterministic": true,
        "side_effects": [
          "installs plugin"
        ]
      },
      {
        "id": "a_002",
        "name": "Run Setup",
        "action_type": "external_call",
        "description": "Configure Claude's connection to 1000+ apps with API key",
        "immutable_elements": [
          "/composio-toolrouter:setup command"
        ],
        "mutable_elements": [
          "API key"
        ],
        "deterministic": false,
        "side_effects": [
          "configures integration"
        ]
      },
      {
        "id": "a_003",
        "name": "Route Tool Request",
        "action_type": "external_call",
        "description": "Tool Router finds the right tool from 1000+ options",
        "immutable_elements": [
          "routing algorithm"
        ],
        "mutable_elements": [
          "user request",
          "target app"
        ],
        "deterministic": false,
        "side_effects": []
      },
      {
        "id": "a_004",
        "name": "Trigger OAuth Authorization",
        "action_type": "await_input",
        "description": "Present OAuth link for first-time app authorization",
        "immutable_elements": [
          "OAuth flow"
        ],
        "mutable_elements": [
          "target app",
          "permissions"
        ],
        "deterministic": false,
        "side_effects": []
      },
      {
        "id": "a_005",
        "name": "Execute Action",
        "action_type": "external_call",
        "description": "Execute the actual action in external app (send email, create issue, etc.)",
        "immutable_elements": [
          "API call execution"
        ],
        "mutable_elements": [
          "action type",
          "parameters"
        ],
        "deterministic": false,
        "side_effects": [
          "performs action in external service"
        ]
      }
    ],
    "rules": [
      {
        "id": "r_001",
        "name": "Check Plugin Installed",
        "condition_type": "existence_check",
        "condition_expression": "composio-toolrouter plugin is installed",
        "returns": "boolean",
        "fail_action": "branch",
        "branching_targets": [
          "install plugin"
        ]
      },
      {
        "id": "r_002",
        "name": "Check Setup Complete",
        "condition_type": "existence_check",
        "condition_expression": "Composio setup has been run",
        "returns": "boolean",
        "fail_action": "branch",
        "branching_targets": [
          "run setup"
        ]
      },
      {
        "id": "r_003",
        "name": "Check App Authorized",
        "condition_type": "existence_check",
        "condition_expression": "Target app has been authorized via OAuth",
        "returns": "boolean",
        "fail_action": "branch",
        "branching_targets": [
          "trigger OAuth"
        ]
      }
    ],
    "directives": [
      {
        "id": "d_001",
        "name": "Action Executed",
        "directive_type": "completion",
        "description": "External action successfully performed",
        "decomposable": true,
        "decomposition_hint": "r_001 → r_002 → a_003 → r_003 → a_005",
        "related_elements": [
          "a_003",
          "a_005"
        ]
      },
      {
        "id": "d_002",
        "name": "First-Time Setup Complete",
        "directive_type": "completion",
        "description": "Plugin installed and configured",
        "decomposable": true,
        "decomposition_hint": "a_001 → a_002",
        "related_elements": [
          "a_001",
          "a_002"
        ]
      },
      {
        "id": "d_003",
        "name": "App Categories Knowledge",
        "directive_type": "knowledge",
        "description": "Email: Gmail, Outlook, SendGrid. Chat: Slack, Discord, Teams. Dev: GitHub, GitLab, Jira. Docs: Notion, Google Docs",
        "decomposable": false
      }
    ]
  },
  "execution_paths": [
    {
      "path_id": 1,
      "sequence": [
        "r_001",
        "r_002",
        "a_003",
        "r_003",
        "a_005"
      ],
      "condition": "User requests action in already-authorized app",
      "expected_outcome": "Action executed successfully"
    },
    {
      "path_id": 2,
      "sequence": [
        "r_001",
        "r_002",
        "a_003",
        "r_003",
        "a_004",
        "a_005"
      ],
      "condition": "First-time use of specific app",
      "expected_outcome": "OAuth completed then action executed"
    },
    {
      "path_id": 3,
      "sequence": [
        "r_001",
        "a_001",
        "a_002"
      ],
      "condition": "First-time plugin setup",
      "expected_outcome": "Plugin installed and configured"
    }
  ],
  "parser_meta": {
    "paths_enumerated": 3,
    "max_paths_exceeded": false,
    "max_paths_limit": 100,
    "decomposition_depth": 1,
    "directives_expandable": 2,
    "requires_deep_parse": false,
    "inconsistency_detected": false
  }
}
