{
  "$schema": "../schema/skill-decomposition.schema.json",
  "meta": {
    "skill_id": "claude__composio__developer_growth_analysis",
    "name": "developer-growth-analysis",
    "skill_layer": "claude_skill",
    "title": "Developer Growth Analysis",
    "description": "Analyzes your recent Claude Code chat history to identify coding patterns, development gaps, and areas for improvement, curates relevant learning resources from HackerNews, and sends a personalized growth report to Slack DMs",
    "schema_version": "2.4.0",
    "parse_timestamp": "2026-01-26T05:45:00Z",
    "parser_version": "skill-0 v2.1",
    "parsed_by": "skill-0"
  },
  "original_definition": {
    "source": "ComposioHQ/awesome-claude-skills",
    "skill_name": "developer-growth-analysis",
    "skill_description": "Analyzes your recent Claude Code chat history to identify coding patterns, development gaps, and areas for improvement, curates relevant learning resources from HackerNews, and automatically sends a personalized growth report to your Slack DMs."
  },
  "decomposition": {
    "actions": [
      {
        "id": "a_001",
        "name": "Read Chat History",
        "action_type": "io_read",
        "description": "Access chat history from ~/.claude/history.jsonl for past 24-48 hours",
        "immutable_elements": [
          "file path",
          "JSONL format"
        ],
        "mutable_elements": [
          "time range filter"
        ],
        "deterministic": true,
        "side_effects": []
      },
      {
        "id": "a_002",
        "name": "Analyze Work Patterns",
        "action_type": "llm_inference",
        "description": "Extract projects, technologies, problem types, challenges, approach patterns",
        "immutable_elements": [
          "analysis framework"
        ],
        "mutable_elements": [
          "chat data",
          "categorization"
        ],
        "deterministic": false,
        "side_effects": []
      },
      {
        "id": "a_003",
        "name": "Identify Improvement Areas",
        "action_type": "llm_inference",
        "description": "Find 3-5 specific, evidence-based, actionable improvement areas",
        "immutable_elements": [
          "identification criteria"
        ],
        "mutable_elements": [
          "patterns found",
          "prioritization"
        ],
        "deterministic": false,
        "side_effects": []
      },
      {
        "id": "a_004",
        "name": "Generate Report",
        "action_type": "transform",
        "description": "Create comprehensive growth report with summary, improvements, strengths, actions",
        "immutable_elements": [
          "report structure"
        ],
        "mutable_elements": [
          "content sections"
        ],
        "deterministic": true,
        "side_effects": []
      },
      {
        "id": "a_005",
        "name": "Search Learning Resources",
        "action_type": "external_call",
        "description": "Search HackerNews for articles relevant to each improvement area",
        "immutable_elements": [
          "search API"
        ],
        "mutable_elements": [
          "search queries",
          "relevance filters"
        ],
        "deterministic": false,
        "side_effects": []
      },
      {
        "id": "a_006",
        "name": "Send Report to Slack",
        "action_type": "external_call",
        "description": "Send formatted report to user's Slack DMs via Rube MCP",
        "immutable_elements": [
          "Slack API"
        ],
        "mutable_elements": [
          "message content",
          "formatting"
        ],
        "deterministic": false,
        "side_effects": [
          "sends Slack message"
        ]
      }
    ],
    "rules": [
      {
        "id": "r_001",
        "name": "Validate Chat History Exists",
        "condition_type": "existence_check",
        "condition_expression": "~/.claude/history.jsonl exists and has recent entries",
        "returns": "boolean",
        "fail_action": "error_throw"
      },
      {
        "id": "r_002",
        "name": "Check Slack Connection",
        "condition_type": "existence_check",
        "condition_expression": "Slack is connected via Rube MCP",
        "returns": "boolean",
        "fail_action": "branch",
        "branching_targets": [
          "initiate Slack auth"
        ]
      }
    ],
    "directives": [
      {
        "id": "d_001",
        "name": "Growth Analysis Complete",
        "directive_type": "completion",
        "description": "Full report generated with resources and sent to Slack",
        "decomposable": true,
        "decomposition_hint": "r_001 → a_001 → a_002 → a_003 → a_004 → a_005 → r_002 → a_006",
        "related_elements": [
          "a_001",
          "a_003",
          "a_006"
        ]
      },
      {
        "id": "d_002",
        "name": "Improvement Criteria",
        "directive_type": "constraint",
        "description": "Improvements must be specific, evidence-based, actionable, and prioritized",
        "decomposable": false,
        "related_elements": [
          "a_003"
        ]
      },
      {
        "id": "d_003",
        "name": "Report Structure",
        "directive_type": "knowledge",
        "description": "Sections: Work Summary, Improvement Areas (prioritized), Strengths Observed, Action Items, Curated Learning Resources",
        "decomposable": false,
        "related_elements": [
          "a_004"
        ]
      }
    ]
  },
  "execution_paths": [
    {
      "path_id": 1,
      "sequence": [
        "r_001",
        "a_001",
        "a_002",
        "a_003",
        "a_004",
        "a_005",
        "r_002",
        "a_006"
      ],
      "condition": "User requests developer growth analysis",
      "expected_outcome": "Personalized report with resources sent to Slack"
    }
  ],
  "parser_meta": {
    "paths_enumerated": 1,
    "max_paths_exceeded": false,
    "max_paths_limit": 100,
    "decomposition_depth": 1,
    "directives_expandable": 1,
    "requires_deep_parse": false,
    "inconsistency_detected": false
  }
}
